Identifier,Language,Category,Event Type,Response Type,Audience,Sender Name,Headline,Description,Instruction,Contact,Parameters
MaldivesMeteorology-2.49.0.0.462.0-20150908-013-alert,en-US,"Infra, Other",Drought,Prepare,,National Disaster Management Center,"Sever drought condistion have caused a Water Shortage in AREAS,Maldivian Councils in AREAS have informed of severe drought conditions. Each Council requires, on average",XXX Tons of drinking water. As of DATE they are at NUMBER Percent capacity. It is estimated that they will require NUMBER Tons of water over the next NUMBER days. Recipients of this message are advised to respond to the crisis.,Drinking Water is for cooking and drinking.Respond to crisis implies activating your emergency response plans,115,
MaldivesMeteorology-2.49.0.0.462.0-20150909-016-alert,en-US,"Rescue, Transport",Earthquake,Evacuate,,Maldives Meterological Service,Earthquake Warninig,Earth quake the MAGNITUDE and it create a  NUMBER of wave,Warning Take shelter,,
MaldivesMeteorology-2.49.0.0.462.0-20150909-016-alert,dv,"Rescue, Transport",Earthquake,Evacuate,ޖެނެރަލް ޕްބްލިކް، މީޑިއާ,މޯލްޑިވްސް މީޓިއޮރޮލޮޖިކަލް ސަރވިސް,ސުނާމީގެ އިންޒާރު ވަރަށް ބޮޑަށް ސީރިއަސް ކަމާއެކު މިކަންތައް ނަގައި,ހެޔޮނުވާނެ ވީހާވެސް އަވަހަށް އެންމެ ކައިރި ހުރި ކަނޑއެޅިފައިވާ އީއޯސީ އަށް ވަޑައިގަންނަވާ. އާދޭސް ކޮށްފައި މި ބުނަނީ.,"1 White, Mean wind speed is expected or prevail between 20-30 mph Rainfall  of more than 50mm is expected to occur within 24 hours High tidal waves are expected, Weather information, but no immediate threat.",,
MaldivesMeteorology-2.49.0.0.462.0-20150910-018-alert,dv,Met,Flood,None,,ނެޝެނަލް ޑިސާސްޓަރ މެނޭޖްމަންޓް ސެންޓަރ,ވާރޭވެހި ފެންބޮޑުވެދާނެ,,,,
PHIVOLS-DOST-2.49.0.0.608.0-20150908-019-alert,en-US,Geo,Tsunami,None,,phivolcs.dost.gov.ph,Tsunami Alert 0: For your information only,No tsunami threat to the Philippines.,for information only,632 426-1468 PHIVOLCS,"""tsunami-wave-height-meter"":""NUMBER"""
PHIVOLS-DOST-2.49.0.0.608.0-20150908-021-alert,en-US,Geo,Tsunami,Avoid,,Philippine Institute of Volcanology and Seismology (PHIVOLCS),Non destructive tsunami occurence,An earthquake with non destructive tsunami,No evacuation needed to coastal area listed below.  Houses situated offshore should moved to higher ground.,632 426 1468 PHIVOLCS DOST,
PHIVOLS-DOST-2.49.0.0.608.0-20150908-035-alert,en-US,Geo,Volcano,"Evacuate, Execute, Avoid",Residence near and around the Mt Mayon Volcano.,Philippine Institute of Volcanology and Seismology (PHIVOLCS),Alert level 5: Eruptions ongoing,additional danger areas will be announce as eruptions continues.,no people allowed inside the 6 km permanent danger zone and and within the additional areas declared unsafe. evacuation plan shall be implemented by local officials in the areas.,632] 426 1468 PHIVOLCS - DOST,
PHIVOLS-DOST-2.49.0.0.608.0-20150910-045-alert,en-US,Geo,Tsunami,"Assess, AllClear",Public,Philippine Institute of Volcanology and Seismology (PHIVOLCS),Tsunami alert cancellation,All tsunami alert in effect in Philippines is now being cancelled .,Local conditions may varies and instruction from local officials should be heed and followed.,632] 426 1468,
PHIVOLS-DOST-2.49.0.0.608.0-20150908-020-alert,en-US,Met,Flood,Prepare,,PAGASA-DOST,General Flood Advisory (SEVERITY) in effect for AREA_NAME,WEATHER_CONDITION. The 24 hour rainfall forecast is Light to moderate rains and isolated thunderstorms. Water courses likely to be affected : + RIVER_PLACE - Rivers and its tributaries particularly PLACES - Rivers and its tributaries particularly PARTICULAR-PLACES,People living near the mountain slopes and in the low lying areas of the above mentioned river systems and the **Local Disaster Risk Reduction and Management Councils** concerned are advised to take neccessary precautionary measures.,643-FLOOD,"""layer:Google:Region:0.1"":""REGION_NUMBER"""
PHIVOLS-DOST-2.49.0.0.608.0-20150908-020-alert,tl,Met,Flood,Prepare,,PAGASA-DOST,General Flood Bulletin ( SEVERITY ) na pinapairal para sa AREA_NAME,Madag-umon na kalangitan inubanan sa hinay ngadto sa kasarangan na mga pag-ulan og pagpanugdog og kilat ang masinati sa Probinsya sa Leyte. Katag-katag na pagpanag-um ngadto sa madag-umon na kalangitan inubanan sa pat-ak pat-ak na mga pag-ulan o pagpanugdog og kilat ang,Madag-umon na kalangitan inubanan sa hinay ngadto sa kasarangan na mga pag-ulan og pagpanugdog og kilat ang masinati sa Probinsya sa Leyte. Katag-katag na pagpanag-um ngadto sa madag-umon na kalangitan inubanan sa pat-ak pat-ak na mga pag-ulan o pagpanugdog og kilat ang,643-FLOOD,"""layer:Google:Region:0.1"":""REGION_NUMBER"""
PHIVOLS-DOST-2.49.0.0.608.0-20150908-023-alert,en-US,Met,Flood,Prepare,,PAGASA-DOST,General Flood Bulletin (SEVERITY) in effect for AREA_NAME,WEATHER_CONDITION. The 24 hour rainfall forecast is Light to moderate rains and isolated thunderstorms. Water courses likely to be affected : + RIVER_PLACE - Rivers and its tributaries particularly PLACES - Rivers and its tributaries particularly PARTICULAR-PLACES,People living near the mountain slopes and in the low lying areas of the above mentioned river systems and the **Local Disaster Risk Reduction and Management Councils** concerned are advised to take neccessary precautionary measures.,643-FLOOD,"""layer:Google:Region:0.1"":""REGION_NUMBER"""
PHIVOLS-DOST-2.49.0.0.608.0-20150908-023-alert,tl,Met,Flood,Prepare,,PAGASA-DOST,General Flood Bulletin ( SEVERITY ) na pinapairal para sa AREA_NAME,Madag-umon na kalangitan inubanan sa hinay ngadto sa kasarangan na mga pag-ulan og pagpanugdog og kilat ang masinati sa Probinsya sa Leyte. Katag-katag na pagpanag-um ngadto sa madag-umon na kalangitan inubanan sa pat-ak pat-ak na mga pag-ulan o pagpanugdog og kilat ang,Madag-umon na kalangitan inubanan sa hinay ngadto sa kasarangan na mga pag-ulan og pagpanugdog og kilat ang masinati sa Probinsya sa Leyte. Katag-katag na pagpanag-um ngadto sa madag-umon na kalangitan inubanan sa pat-ak pat-ak na mga pag-ulan o pagpanugdog og kilat ang,643-FLOOD,"""layer:Google:Region:0.1"":""REGION_NUMBER"""
Myanmar DMH-2.49.0.0.104.0-20150908-030-alert,en-US,Met,Flood,Monitor,,"Hydrological Division, Department of Meteorology and Hydrology",Flood Bulletin in affected in XXX City,According to the (06:30) hrs M.S.T observation today,the water level of Bago River have exceeded by about (2) feet at Bago above its danger level. The water level may continue to rise about (1) foot during next (24) hour and may remain above its danger level. Please stay in shelter and safely place.,+9567411254,"""max_wl_height"":""NUMBER"""
Myanmar DMH-2.49.0.0.104.0-20150908-030-alert,my,Met,Flood,Monitor,,ဇလေဗဒဌာနခြဲ (ေနျပည္ေတာ္)၊ မုိး၊ဇလ,ျမစ္ေရႀကီးမွု အေျခအေနသတင္း (မေကြးၿမဳိ႕),ယေန႕ျမန္မာစံေတာ္ခ်ိန္ (၁၂း၃၀) နာရီအခ်ိန္ တုိင္းထြာခ်က္အရ ဧရာ၀တီၤျမစ္ေရသည္ မေကြးၿမဳိ႕တြင္ (၂)ေပခန္႕ စုိးရိမ္ေရမွတ္အထက္ ေက်ာ္လြန္ေနပါသည္။ ေနာက္ (၃) ရက္အတြင္း (၁)ေပခန္႕ က်ဆင္းႏုိင္ၿပီး ယင္းၿမဳိ႕၏ စုိးရိမ္ေရမွတ္အထက္ တြင္ ဆက္လက္တည္ရွိႏုိင္ပါသည္။,"မုိးဇလမွ ဆက္လက္ထုတ္ျပန္မည့္ သတင္းမ်ားကုိ နားေထာင္ၾကရန္.
သက္ဆုိင္ရာဌာနမွ ထုတ္ျပန္သည့္ ေရွာင္ရန္ ေဆာင္ရန္မ်ားကုိ လုိက္နာၾကရန္",+၉၅၆၇၄၁၁၂၅၄,
Myanmar DMH-2.49.0.0.104.0-20150908-021-alert,my,Met,Flood,Prepare,,ံဇလေဗဒဌာနခြဲ။ မုိး၊ဇလ(ေနျပည္ေတာ္),ျမစ္ေရႀကီးျခင္း သတိေပးခ်က္ (မေကြး),ယေန႕ ျမန္မာစံေတာ္ခ်ိန္ (၀၆း၃၀) နာရီ အခ်ိန္တုိင္းထြာခ်က္အရ သံလြင္ျမစ္ေရသည္ ဘားအံၿမဳိ႕တြင္ ယင္းၿမဳိ႕၏ စုိးရိမ္ေရမွတ္ေအာက္ (၆၀) စင္တီမီတာ (၂-ေပခန္႕) တြင္ ေရာက္ရွိေန ပါသည္။ အဆုိပါ ျမစ္ေရသည္ ယေနမြန္းတည့္မွေနာက္ ေနာက္(၄၈) နာရီအတြင္း ယင္းၿမဳိ႕၏ စုိးရိမ္ေရမွတ္သုိ့ ေရာက္ရွိႏုိင္ပါသည္။,ေျမနိမ့္ပုိင္းႏွင့္ ျမစ္ကမ္းနံေဘးေနထုိင္သူမ်ား သတိျပဳ ေနထုိင္ၾကပါရန္,+၉၅၆၇၄၁၁၂၅၄,
Myanmar DMH-2.49.0.0.104.0-20150908-033-alert,en-US,Met,Flood,AllClear,,"Hydrological Division, Department of Meteorology and Hydrology",Flood Bulletin in affected in XXX City (Falling),"According to the HH:MM:SS hrs MST (UTC+6:30) observation today, the water level  of RIVERNAME River at STATION have EXCEED by about NUMBERWORDS (NUMBER) feet above its danger level. The water level my FALL approximately NUMBERWORDS (NUMBER) feet during next NUMBERWORDS (NUMBER) days and may FALL below its danger level during next NUMBERWORDS (NUMBER) days.","EXCEED implies that the water level has reached beyond a threshold level
FALL",+9567411254,
Myanmar DMH-2.49.0.0.104.0-20150907-018-alert,en-US,Geo,Tsunami,Prepare,Public and first responder,National Tsunami Early Warning Center,Tsunami Warning,A very strong earthquake of magnitude (___) Richter Scale with its epicenter in _____________ was recorded at (__) hrs (__) min (__) sec M.S.T on ______________.,"Tsunami was generated and tsunami threat has already passed Myanmar coast. With the safe return of residents, Department of Meteorology and Hydrology announces that there is no more threat of tsunami.",NTWC +95 67 411269,"""Tsunami Height_meter"":""NUMBER"",""Destination"":""PLACE"""
