Parent,Organisation
Asia-Pacific Region,Brunei Darussalam Red Crescent Society
Asia-Pacific Region,Malaysian Red Crescent Society
Asia-Pacific Region,Singapore Red Cross Society
CCST Bangkok,Cambodian Red Cross Society
CCST Bangkok,Lao Red Cross
CCST Bangkok,Thai Red Cross Society
CCST Bangkok,Viet Nam Red Cross
CCST Beijing,Hong Kong Red Cross
CCST Beijing,Japanese Red Cross Society
CCST Beijing,Macau Red Cross
CCST Beijing,Mongolian Red Cross Society
CCST Beijing,Red Cross Society of China
CCST Beijing,Red Cross Society of the Republic of China (Taiwan)
CCST Beijing,Republic of Korea National Red Cross
CCST Fiji,Australian Red Cross
CCST Fiji,Cook Islands Red Cross
CCST Fiji,Fiji Red Cross Society
CCST Fiji,Kiribati Red Cross Society
CCST Fiji,Micronesia Red Cross Society
CCST Fiji,New Zealand Red Cross
CCST Fiji,Palau Red Cross Society
CCST Fiji,Papua New Guinea Red Cross Society
CCST Fiji,Samoa Red Cross Society
CCST Fiji,Solomon Islands Red Cross
CCST Fiji,Tonga Red Cross Society
CCST Fiji,Tuvalu Red Cross Society
CCST Fiji,Vanuatu Red Cross Society
CCST India,Indian Red Cross Society
CCST India,Maldivian Red Crescent
CCST India,Sri Lanka Red Cross Society
CCST Jakarta,Indonesian Red Cross Society (Palang Merah Indonesia)
CCST Jakarta,Timor-Leste Red Cross Society (Cruz Vermelha de Timor-Leste)
CO Afghanistan,Afghan Red Crescent Society
CO Bangladesh,Bangladesh Red Crescent Society
CO DPRK,Red Cross Society of the Democratic People's Republic of Korea
CO Myanmar,Myanmar Red Cross Society
CO Nepal,Nepal Red Cross Society
CO Pakistan,Pakistan Red Crescent Society
CO Philippines,Philippine Red Cross