Organisation,Event,Project,Code,Programme,Status,Start Date,End Date,Budget,Locations,Donors
Save the Children,Typhoon Koppu,PHL Support to emergency needs of populations affected by Typhoon Koppu in Northern and Central Luzon,72400162,,Active,2015-11-15,2016-03-14,,,CARE Nederland
Save the Children,Typhoon Koppu,PHL CEF Response to Philippines Typhoon Lando,82602699,,Closed,2015-10-18,2016-01-17,,,Save the Children UK
Save the Children,Typhoon Koppu,PHL CSF Philippines Typhoon Koppu Response,99700236,PHL 2015 Typhoon Koppu Response,Closed,2015-10-22,2016-01-21,,,
Save the Children,Typhoon Koppu,PHL_IKEA Seed for the Typhoon Koppu Response,75200888,PHL 2015 Typhoon Koppu Response,Active,2015-10-19,2016-01-18,,,IKEA Foundation
Save the Children,Typhoon Koppu,PHL SCA Appeal - Typhoon Koppu 2015,03601075,,Closed,2015-10-01,2016-10-01,,,Save the Children Australia
