"name","description","position","template"
"Assessment Team","Details of the assessment team","1","Master"
"Summary","Summary of the Crisis","2","Master"
"Key Issues","Key issues identified by section","3","Master"
"Population","Population Description","4","Master"
"Shelter","Shelter and essential non-food items","5","Master"
"Watsan","Water Supply, Sanitation and Hygiene","6","Master"
"Food","Food Security and Nutrition","7","Master"
"Health","Health Risks and Health Status","8","Master"
"Education","Educational Situation","9","Master"
